[
  {
    "appointment_id": "APT-DEMO-5001",
    "synthetic": true,
    "data_source": "call-center-demo-synth-v1",
    "member_id": "MBR-DEMO-000101",
    "provider_id": "PRV-DEMO-2002",
    "scheduled_datetime": "2026-10-10T9:00:00-04:00",
    "type": "Follow-up",
    "modality": "in_person",
    "status": "SCHEDULED",
    "location": "Lakeview Medical Plaza",
    "reschedule_eligible": true,
    "reschedule_notes": null
  },
  {
    "appointment_id": "APT-DEMO-5002",
    "synthetic": true,
    "data_source": "call-center-demo-synth-v1",
    "member_id": "MBR-DEMO-000102",
    "provider_id": "PRV-DEMO-2003",
    "scheduled_datetime": "2026-10-11T10:00:00-04:00",
    "type": "Follow-up",
    "modality": "in_person",
    "status": "SCHEDULED",
    "location": "Lakeview Medical Plaza",
    "reschedule_eligible": true,
    "reschedule_notes": null
  },
  {
    "appointment_id": "APT-DEMO-5003",
    "synthetic": true,
    "data_source": "call-center-demo-synth-v1",
    "member_id": "MBR-DEMO-000103",
    "provider_id": "PRV-DEMO-2004",
    "scheduled_datetime": "2026-10-12T11:00:00-04:00",
    "type": "Follow-up",
    "modality": "in_person",
    "status": "SCHEDULED",
    "location": "Cedar Hill Medical Plaza",
    "reschedule_eligible": true,
    "reschedule_notes": null
  },
  {
    "appointment_id": "APT-DEMO-5004",
    "synthetic": true,
    "data_source": "call-center-demo-synth-v1",
    "member_id": "MBR-DEMO-000113",
    "provider_id": "PRV-DEMO-2005",
    "scheduled_datetime": "2026-10-15T10:30:00-04:00",
    "type": "New patient visit",
    "modality": "telehealth",
    "status": "SCHEDULED",
    "location": "Cedar Hill Medical Plaza",
    "reschedule_eligible": true,
    "reschedule_notes": null
  },
  {
    "appointment_id": "APT-DEMO-5005",
    "synthetic": true,
    "data_source": "call-center-demo-synth-v1",
    "member_id": "MBR-DEMO-000114",
    "provider_id": "PRV-DEMO-2006",
    "scheduled_datetime": "2026-10-16T11:30:00-04:00",
    "type": "Follow-up",
    "modality": "in_person",
    "status": "SCHEDULED",
    "location": "Cedar Hill Medical Plaza",
    "reschedule_eligible": true,
    "reschedule_notes": null
  },
  {
    "appointment_id": "APT-DEMO-5006",
    "synthetic": true,
    "data_source": "call-center-demo-synth-v1",
    "member_id": "MBR-DEMO-000115",
    "provider_id": "PRV-DEMO-2007",
    "scheduled_datetime": "2026-10-17T12:30:00-04:00",
    "type": "Follow-up",
    "modality": "telehealth",
    "status": "SCHEDULED",
    "location": "Riverside Medical Plaza",
    "reschedule_eligible": true,
    "reschedule_notes": null
  },
  {
    "appointment_id": "APT-DEMO-5007",
    "synthetic": true,
    "data_source": "call-center-demo-synth-v1",
    "member_id": "MBR-DEMO-000116",
    "provider_id": "PRV-DEMO-2008",
    "scheduled_datetime": "2026-10-18T13:30:00-04:00",
    "type": "Annual physical",
    "modality": "in_person",
    "status": "SCHEDULED",
    "location": "Harborview Medical Plaza",
    "reschedule_eligible": true,
    "reschedule_notes": null
  },
  {
    "appointment_id": "APT-DEMO-5008",
    "synthetic": true,
    "data_source": "call-center-demo-synth-v1",
    "member_id": "MBR-DEMO-000117",
    "provider_id": "PRV-DEMO-2009",
    "scheduled_datetime": "2026-09-20T13:00:00-04:00",
    "type": "Follow-up",
    "modality": "in_person",
    "status": "SCHEDULED",
    "location": "Lakeview Medical Plaza",
    "reschedule_eligible": true,
    "reschedule_notes": null
  },
  {
    "appointment_id": "APT-DEMO-5009",
    "synthetic": true,
    "data_source": "call-center-demo-synth-v1",
    "member_id": "MBR-DEMO-000118",
    "provider_id": "PRV-DEMO-2001",
    "scheduled_datetime": "2026-09-21T13:00:00-04:00",
    "type": "Follow-up",
    "modality": "in_person",
    "status": "SCHEDULED",
    "location": "Harborview Medical Plaza",
    "reschedule_eligible": true,
    "reschedule_notes": null
  },
  {
    "appointment_id": "APT-DEMO-5010",
    "synthetic": true,
    "data_source": "call-center-demo-synth-v1",
    "member_id": "MBR-DEMO-000119",
    "provider_id": "PRV-DEMO-2002",
    "scheduled_datetime": "2026-09-04T15:00:00-04:00",
    "type": "Follow-up",
    "modality": "in_person",
    "status": "SCHEDULED",
    "location": "Lakeview Medical Plaza",
    "reschedule_eligible": false,
    "reschedule_notes": "Same-day reschedule requests are not eligible per scheduling policy; member must call the office directly."
  }
]
